{
  "action": "apply",
  "actor_id": "honua-devops:urn:honua:provisioning:00000000000000000000000000000000",
  "backend": {
    "backend_access_role_arn": null,
    "backend_config_digest": "0ea699e4b738a98ed5c9a7ce497ad94b7922fe0d1e86c88e38ba5be3902036a3",
    "backend_kind": "s3",
    "bucket_arn": "arn:aws:s3:::honua-tfstate-fixture",
    "bucket_id": "honua-tfstate-fixture",
    "encryption": {
      "enabled": true,
      "kms_key_reference": "arn:aws:kms:us-east-1:123456789012:key/fixture"
    },
    "is_remote": true,
    "locking": {
      "detail": "honua/aws/dev/terraform.tfstate.tflock",
      "kind": "s3-native-lockfile"
    },
    "object_key": "honua/aws/dev/terraform.tfstate",
    "region": "us-east-1",
    "workspace": "default"
  },
  "candidate_digest": null,
  "created_at_utc": "2026-08-28T21:02:21Z",
  "evidence_scope": "metadata-only-pre-apply",
  "expires_at_utc": "2026-08-28T21:32:21Z",
  "identity": {
    "account_id": "123456789012",
    "assumed_role_arn": "arn:aws:sts::123456789012:assumed-role/honua-deploy-dev/session",
    "credential_kind": "sts-assumed-role",
    "evidence_mode": "offline-test",
    "issuer": "https://token.actions.githubusercontent.com",
    "partition": "aws",
    "role_id": "AROAEXAMPLEID",
    "session_expires_at_utc": "2099-01-01T00:00:00Z"
  },
  "inputs": {
    "input_digest": "d2f3f88a0223cd1f6c2176002352a563762ea25ec4c776ccfe8abe1ab6531afd",
    "input_refs": [
      "autofile:small.auto.tfvars.json",
      "varfile:/tmp/tmp.9LP3Jbkmup/base/infrastructure/terraform/examples/aws/small.auto.tfvars.json"
    ]
  },
  "kind": "honua.iac.exact-plan",
  "plan": {
    "path": "honua.tfplan",
    "sha256": "3a691c59f9c8be1eb1ce3e7642643a7aedfa7a0314c8d01750546ea83efca6fe"
  },
  "posture": {
    "dirty_source_allowed": false,
    "local_state_allowed": false,
    "release_qualified": false
  },
  "qualification_status": "unqualified",
  "schema_version": "v1",
  "source": {
    "iac_revision": "3c39cc9c54ba70ec0f6449004647b383e68c1709",
    "iac_tree_digest": "4276930e071ec5e3b65a15480fbd755ff448e0bee7c8075b1c969933027219ae",
    "module_sources": [],
    "terraform_root": "infrastructure/terraform/examples/aws-serverless"
  },
  "state_before": {
    "lineage": "0a1b2c3d-4e5f-6071-8293-a4b5c6d7e8f9",
    "serial": 12
  },
  "target_id": "honua-contract-dev-honua-live",
  "toolchain": {
    "provider_lock_digest": "abba0b4b7705414a674e111af76e99600390b3483f3a6e5084fee8235e58e08e",
    "terraform_version": "1.10.5"
  },
  "workload_identity_contract_digest": null,
  "plan_metadata_digest": "89ace46fd5223c79602f492294b6a7cd70c1124559d9f66511e8d8effbb58434"
}
